{
  "$schema": "http://json-schema.org/draft-07/schema#",
  "title": "InsectAI Hardware Database Schema",
  "description": "JSON Schema for validating hardware-db_schema.json structure and versioning",
  "type": "object",
  "additionalProperties": false,
  "properties": {
    "_metadata": {
      "type": "object",
      "description": "Schema versioning and metadata",
      "additionalProperties": false,
      "properties": {
        "schema_version": {
          "type": "string",
          "pattern": "^\\d+\\.\\d+\\.\\d+(-[a-zA-Z0-9.]+)?$",
          "description": "Semantic version (MAJOR.MINOR.PATCH) with optional pre-release label (e.g. 1.0.0-beta)"
        },
        "created_date": {
          "type": "string",
          "format": "date-time",
          "description": "ISO 8601 timestamp when this schema version was created"
        },
        "description": {
          "type": "string",
          "description": "Human-readable description of this schema version"
        }
      },
      "required": ["schema_version", "created_date", "description"]
    },
    "info": {
      "type": "object",
      "additionalProperties": false,
      "properties": {
        "title": { "type": "string" },
        "description": { "type": "string" }
      },
      "required": ["title", "description"]
    },
    "settings": {
      "type": "object",
      "additionalProperties": false,
      "properties": {
        "emailCollectionType": { "type": "string" }
      },
      "required": ["emailCollectionType"]
    },
    "sections": {
      "type": "array",
      "items": {
        "type": "object",
        "additionalProperties": false,
        "properties": {
          "id": { "type": "string" },
          "title": { "type": "string" },
          "description": {
            "type": ["string", "null"]
          },
          "questions": {
            "type": "array",
            "items": {
              "type": "object",
              "additionalProperties": false,
              "properties": {
                "id": { "type": "string" },
                "title": { "type": "string" },
                "description": { "type": ["string", "null"] },
                "required": { "type": "boolean" },
                "type": {
                  "type": "string",
                  "enum": ["text", "choice", "scale", "file_upload"]
                },
                "paragraph": { "type": "boolean" },
                "choiceType": { "type": "string" },
                "high": { "type": "number" },
                "low": { "type": "number" },
                "options": {
                  "type": "array",
                  "items": { "type": "string" }
                },
                "isOther": {
                  "type": "array",
                  "items": { "type": "boolean" }
                },
                "logic": {
                  "type": "object",
                  "additionalProperties": {
                    "type": "object",
                    "additionalProperties": false,
                    "properties": {
                      "go_to": { "type": "string" }
                    },
                    "required": ["go_to"]
                  }
                }
              },
              "required": ["id", "title", "required", "type"]
            }
          }
        },
        "required": ["id", "title"]
      }
    }
  },
  "required": ["_metadata", "info", "settings", "sections"]
}
