{
  "_metadata": {
    "schema_version": "1.0.0-beta",
    "created_date": "2026-05-26T00:00:00Z",
    "description": "v1.0.0-beta: Questionnaire improvements — fixed malformed choice options, aligned required fields with DevNotes recommendation, added Wildlabs Inventory-aligned fields (device_type, device_availability, device_maturity), replaced placeholder descriptions."
  },
  "info": {
    "title": "InsectAI hardware form - full version",
    "description": "Welcome! This form is to submit or update your insect monitoring hardware to the InsectAI hardware database. \n \n Already submitted hardware or have a new version? You may also use this form to submit new versions of existing hardware or add/update existing hardware details. If so, please provide your latest deviceID where prompted. \n\n Unsure if you have already submitted? If you are unsure what has already been submitted to the database please either 1. check your email for a deviceID 2. access the public database here: [PLACEHOLDER: public database URL] or 3. contact the current handler whose details will be available here: [PLACEHOLDER: contact page URL] providing them with some basic hardware details. \n\n "
  },
  "settings": {
    "emailCollectionType": "DO_NOT_COLLECT"
  },
  "sections": [
    {
      "id": "device_id_section",
      "title": "Device ID and version",
      "description": null,
      "questions": [
        {
          "id": "have_deviceID",
          "title": "Do you already have a deviceID for this hardware?",
          "required": true,
          "type": "choice",
          "choiceType": "RADIO",
          "options": [
            "Yes",
            "No"
          ],
          "logic": {
            "Yes": {
              "go_to": "new_device_version"
            },
            "No": {
              "go_to": "basic_info"
            }
          }
        }
      ]
    },
    {
      "id": "new_device_version",
      "title": "New device version",
      "description": "Use this section if you are submitting a new version of hardware that already has a deviceID. \n \n To help decide if your device has entered a new version, the following adaptation of semantic versioning for hardware may be useful: https://www.maskset.net/blog/2023/02/26/semantic-versioning-for-hardware/ \n \n If you want to update an existing entry rather than add a new version, please contact us via: [PLACEHOLDER: contact page URL]",
      "questions": [
        {
          "id": "previous_deviceID",
          "title": "Previous deviceID",
          "required": true,
          "type": "text",
          "paragraph": false
        }
      ]
    },
    {
      "id": "basic_info",
      "title": "Basic information",
      "description": "These four fields form the minimum required submission. They correspond directly to the mandatory fields in Wildlabs's The Inventory.",
      "questions": [
        {
          "id": "contact_name",
          "title": "Contact name",
          "required": true,
          "type": "text",
          "paragraph": false
        },
        {
          "id": "contact_email",
          "title": "Contact email",
          "required": true,
          "type": "text",
          "paragraph": false
        },
        {
          "id": "device_name",
          "title": "Device name",
          "required": true,
          "type": "text",
          "paragraph": false
        },
        {
          "id": "device_description",
          "title": "Device description",
          "required": true,
          "type": "text",
          "paragraph": true
        },
        {
          "id": "device_type",
          "title": "Technology type (select all that apply)",
          "required": false,
          "type": "choice",
          "choiceType": "CHECKBOX",
          "options": [
            "Animal borne imaging",
            "Bioacoustics",
            "Biologger / tracking",
            "Camera traps",
            "Data management and processing",
            "eDNA",
            "Image recognition",
            "Mobile apps / citizen science",
            "Navigation / communication / connectivity",
            "Networked sensors",
            "Protected area management",
            "Remote sensing / GIS",
            "Thermal imaging",
            "UAVs / drones",
            "Other"
          ]
        }
      ]
    },
    {
      "id": "fill_in_full_form",
      "title": "Proceed with filling in full form?",
      "description": "Would you like to proceed with filling in the full form? \n\n There are 6 sections in total with a total of approximately 67 questions: \n - Contributor details (7 questions); \n - Device links (4 questions); \n - Device details (13 questions); \n - Component details (27 questions); \n - Maintenance and repairs (3 questions); \n - Usage scope (12 questions). \n\n  If you would like to stop here, please click 'No' and then Submit on the next page. ",
      "questions": [
        {
          "id": "to_full_form",
          "title": "Proceed with filling in full form?",
          "required": true,
          "type": "choice",
          "choiceType": "RADIO",
          "options": [
            "Yes, take me to the questions",
            "No, I want to submit with just the basic information"
          ],
          "logic": {
            "Yes, take me to the questions": {
              "go_to": "contributor_details"
            },
            "No, I want to submit with just the basic information": {
              "go_to": "submit_form"
            }
          }
        }
      ]
    },
    {
      "id": "contributor_details",
      "title": "Contributor details",
      "description": "Information about who the device was created by, who is contributing to this entry and who will be responsible in future for queries about and updates to this entry. \n \n These may all be the same individual in some cases and there may be co-creators. In the case of multiple individuals, separate names and emails with ';' (e.g. Alan Turner; Dave Johnson).",
      "questions": [
        {
          "id": "contributor_name",
          "title": "Contributor name (can be the same as contact name)",
          "required": false,
          "type": "text",
          "paragraph": false
        },
        {
          "id": "contributor_email",
          "title": "Contributor email (can be the same as contact email)",
          "required": false,
          "type": "text",
          "paragraph": false
        },
        {
          "id": "institution_name",
          "title": "Institution name(s)",
          "required": false,
          "type": "text",
          "paragraph": false
        },
        {
          "id": "device_creator",
          "title": "Device creator(s)",
          "required": false,
          "type": "text",
          "paragraph": false
        },
        {
          "id": "device_creator_email",
          "title": "Device creator email(s)",
          "required": false,
          "type": "text",
          "paragraph": false
        },
        {
          "id": "maintainer_name",
          "title": "Maintainer name",
          "required": false,
          "type": "text",
          "paragraph": false
        },
        {
          "id": "maintainer_email",
          "title": "Maintainer email",
          "required": false,
          "type": "text",
          "paragraph": false
        }
      ]
    },
    {
      "id": "device_links",
      "title": "Device links",
      "description": "Links to publications, code repositories, and documentation relating to this device. Leave blank if not applicable.",
      "questions": [
        {
          "id": "publication_DOI",
          "title": "Publication DOI",
          "required": false,
          "type": "text",
          "paragraph": false
        },
        {
          "id": "github_link",
          "title": "Github link",
          "required": false,
          "type": "text",
          "paragraph": false
        },
        {
          "id": "documentation_link",
          "title": "Documentation link",
          "required": false,
          "type": "text",
          "paragraph": false
        },
        {
          "id": "documentation_upload",
          "title": "Documentation upload (link to file or cloud storage)",
          "required": false,
          "type": "text",
          "paragraph": false
        }
      ]
    },
    {
      "id": "device_details",
      "title": "Device details",
      "description": "Physical and design characteristics of the device.",
      "questions": [
        {
          "id": "device_version_name",
          "title": "Device version name",
          "required": false,
          "type": "text",
          "paragraph": false
        },
        {
          "id": "device_licence",
          "title": "Device licence (e.g. CC-BY-4.0)",
          "required": false,
          "type": "text",
          "paragraph": false
        },
        {
          "id": "device_availability",
          "title": "Availability",
          "required": false,
          "type": "choice",
          "choiceType": "RADIO",
          "options": [
            "Available for group buy",
            "Commercial",
            "Crowdfunding",
            "Free",
            "Open source",
            "Other"
          ]
        },
        {
          "id": "device_maturity",
          "title": "Maturity / development stage",
          "required": false,
          "type": "choice",
          "choiceType": "RADIO",
          "options": [
            "Early stage / prototype",
            "In trials / pilot",
            "Tested and implemented"
          ]
        },
        {
          "id": "device_construction",
          "title": "Device construction",
          "required": false,
          "type": "choice",
          "choiceType": "CHECKBOX",
          "options": [
            "Off-the-shelf: Purchased and used as-is",